{
  "effective_window": {
    "end_at": "2026-03-05T12:30:00.987654321Z",
    "start_at": "2026-03-05T04:30:00.123456789Z",
    "zone_id": "America/New_York"
  },
  "excluded": false,
  "generated_at": "2026-03-05T14:00:00Z",
  "manual_corrections": [
    {
      "changes": {
        "start_at": "2026-03-05T04:10:00Z"
      },
      "correction_id": "cor_review_1",
      "created_at": "2026-03-05T13:00:00Z"
    },
    {
      "changes": {
        "excluded": true,
        "start_at": "2026-03-05T04:20:00Z"
      },
      "correction_id": "cor_review_2",
      "created_at": "2026-03-05T13:00:00Z"
    }
  ],
  "needs_review": true,
  "observation_id": "obs_review",
  "schema_version": "v1",
  "sleep_classification": "principal",
  "source_cursor": 3,
  "source_revision": "2026-03-05T12:35:00Z",
  "source_window": {
    "end_at": "2026-03-05T12:30:00.987654321Z",
    "start_at": "2026-03-05T04:30:00.123456789Z",
    "zone_id": "America/New_York"
  }
}
